product_name,actual_price,discount_price,description,processor,ram,storage,graphic_card,display_size,battery,resolution,ports,operating_system,image_link,product_link
Laptop Vaio FE 14 VWNC51427-BL,17.990.000đ,13.990.000đ,"Mang thiết kế mới mẻ với lớp áo xanh dương thời thượng
Màn hình 14.1 inch Full HD giúp hiển thị sắc nét, màu sắc chân thực
CPU Intel Core i5-1235U mạnh mẽ cân mọi tác vụ học tập, văn phòng
RAM 8GB chuẩn DDR4 hỗ trợ duyệt web nhanh chóng mà không lo lag, giật
Không gian lưu trữ rộng rãi giúp lưu trữ nhiều tệp, tài liệu với ổ cứng 512 GB 
",,,,,,,,,,,https://cellphones.com.vn/laptop-vaio-fe-14-vwnc51427-bl.html
Laptop Vaio FE 15 VWNC51527-BL,Giá Liên Hệ,Giá Liên Hệ,"Khoác lên mình lớp vỏ màu bạc sáng bóng, sang trọng
Cân mọi tác vụ học tập, làm việc với CPU Intel Core i5-1235U
VGA Intel Iris Xe Graphics hỗ trợ chỉnh sửa hình ảnh, chơi game cơ bản
RAM 8GB đa nhiệm giúp duyệt web nhanh chóng
Ổ cứng 512GB PCIe SSD rộng rãi lưu trữ nhiều file, tài liệu học tập
",,,,,,,,,,,https://cellphones.com.vn/laptop-vaio-fe-15-vwnc51527-bl.html
Laptop Vaio FE 14 VWNC71429-BK,Giá Liên Hệ,Giá Liên Hệ,"Sở hữu thiết kế lịch lãm với màu đen sang trọng
Màn hình 14.1 inch Full HD cùng tấm nền IPS hỗ trợ hình ảnh sắc nét, mãn nhãn
CPU Intel Core i7-1255U mạnh mẽ, giúp giải quyết nhanh chóng mọi tác vụ từ nặng đến nhẹ
RAM 16GB giúp mở hàng chục tab Chrome cùng lúc mà không lo lag, giật
Ổ cứng với khoang lưu trữ rộng rãi lên đến 1TB SSD giúp lưu mọi file, hình ảnh cùng lúc
",,,,,,,,,,,https://cellphones.com.vn/laptop-vaio-fe-14-vwnc71429-bk.html
Laptop Vaio FE 15 VWNC51527-BK,Giá Liên Hệ,Giá Liên Hệ,"Mang thiết kế sang trọng với màu đen lịch lãm cùng viền màn hình siêu mỏng
Mọi tác vụ học tập, làm việc đều được giải quyết nhanh chóng với CPU Intel Core i5-1235U
Đồ họa Intel Iris Xe Graphics hỗ trợ chỉnh sửa hình ảnh cơ bản
RAM 8GB đa nhiệm giúp duyệt web nhanh chóng
Ổ cứng 512GB PCIe SSD dư sức lưu trữ nhiều file, tài liệu học tập
",,,,,,,,,,,https://cellphones.com.vn/laptop-vaio-fe-15-vwnc51527-bk.html
